,email,subject,email_content
0,treynolds@nvidia.net,Elevate Your Nvidia Marketing Strategies with AI,"Hello Terry,

In the fast-paced world of digital marketing, standing out and making an impact is paramount, especially for a tech leader like Nvidia. At Streak, we recognize the unique challenges you face and have developed a solution to overcome them: a revolutionary AI-driven email marketing platform.

Streak is more than just a tool; it's a partnership for future success. Our platform is designed to create highly personalized email campaigns that resonate with each individual in your audience, ensuring your messages are always relevant and engaging.

The technology sector is constantly evolving, with advancements such as the surge in semiconductor production and the growing demand for AI servers. Streak is here to ensure Nvidia stays ahead, offering a platform that not only keeps pace with but also anticipates the future of marketing.

Choosing Streak means enhancing your marketing efficiency and setting new benchmarks for engagement and conversion. Our AI-driven solution aligns perfectly with Nvidia's strategy, helping you build stronger connections and achieve outstanding results.

Let's explore the possibilities together. Discover how Streak can elevate your marketing campaigns by scheduling a personalized demonstration today.

Best regards,

Omer Nauer
Streak
omern@streak.com"
1,michaeld@salesforce.com,Elevate Your Email Strategy with AI-Powered Personalization 🚀,"Dear Michael,

In the rapidly evolving digital landscape, capturing the attention of your audience is increasingly challenging. As a Marketing Coordinator at Salesforce, you're at the cutting edge, seeking innovative solutions to enhance customer engagement and stimulate growth. That's precisely where our latest platform, Streak, steps in.

Streak is engineered to transform your email marketing efforts by leveraging AI for personalized email campaigns at scale. Envision each of your emails tailored to resonate deeply with its recipient, making your communications not just visible, but impactful. In today's market, personalization isn't just preferred; it's expected. Streak provides a competitive edge, offering unmatched personalization capabilities.

With Salesforce's recent move to cater to the SMB market through the 'Pro Suite', as noted in a Global Village Space article, it's evident that there's a growing demand for customization and sophisticated features among your clientele. Streak is the perfect complement, enabling you to craft personalized, compelling email campaigns that can integrate effortlessly with your existing services, thereby enhancing engagement and increasing conversions.

Step into the future of marketing with Streak, where efficiency and personalization converge. Our platform promises not only to refine your email campaigns but also supports Salesforce's commitment to delivering advanced, scalable solutions for businesses of all sizes.

Let's explore how Streak can integrate with your current strategies to boost customer engagement. I'm eager to discuss how our platform can support your goals.

Warm regards,

Omer Nauer
omern@streak.com
Streak"
2,logansandavol@tesla.com,Elevate Tesla's Email Marketing with Streak's AI Technology,"Dear Dr. Logan Sandoval,

I hope this message finds you in good spirits. As Tesla continues to redefine the electric vehicle landscape, your team's dedication to sustainable innovation, particularly with projects like Giga Berlin, has not gone unnoticed. Your efforts mirror Tesla's commitment to excellence and innovation, a sentiment we deeply share at Streak.

In today's fast-paced digital world, personalized communication stands out, especially when showcasing the transformative nature of products like those of Tesla. This is where Streak steps in. Our AI-driven platform is crafted to revolutionize email marketing by generating personalized campaigns at scale, ensuring each message is as unique and forward-thinking as Tesla's approach to vehicle production.

With Streak, imagine executing marketing campaigns that match the innovation and customization Tesla is known for. Our platform is designed to create messages that not only stand out in crowded inboxes but also drive unparalleled engagement and conversions. This is the future of marketing—efficiency fused with personalization.

We believe Streak can significantly enhance Tesla's email marketing strategies, making every communication as impactful and customer-focused as the vehicles you create. Our team is eager to discuss how we can collaborate to take Tesla's email campaigns to the next level, reflecting the innovation and uniqueness that define your brand.

Let's set a new benchmark for digital communication in the automotive industry together. I look forward to the opportunity to connect and discuss how Streak can contribute to Tesla's vision for a sustainable, technology-driven future.

Warm regards,

Omer Nauer
Streak
omern@streak.com"
3,tross123@bloomgberg.com,Elevate Your Email Campaigns with AI Personalization,"Dear Tina Ross,

In today’s saturated digital space, making your mark in a crowded inbox is increasingly challenging. Yet, inspired by the resilience and innovation observed in sectors like the Chinese cinema industry, which has seen remarkable growth through technology adoption, we at Streak have developed a solution that embodies this same spirit.

Personalization is at the core of what we do. Our AI-driven platform enables brands to craft personalized email campaigns at scale, ensuring that each message uniquely resonates with its recipient, thereby boosting engagement and conversions significantly.

The world is evolving, with advancements across various sectors highlighting the need for forward-thinking technologies that make a real difference. Streak leads this revolution, offering a platform that tailors each message to reflect your brand’s essence and directly connect with your audience.

Imagine achieving the level of personalization that has propelled industries to new heights. With Streak, this is within your reach. Our platform empowers you, Tina, to create campaigns that not only stand out but also engage and convert, efficiently utilizing your time and resources.

We invite you to explore the future of marketing with Streak. Let’s transform how you connect with your audience, turning every email into a memorable experience. For a tailored demonstration or to discuss how Streak can meet your specific needs, please feel free to contact me directly at omern@streak.com.

Best regards,

Omer Nauer
Streak"
4,jacks99@wayfair.com,Unleash the Power of Personalization in Your Email Campaigns with Streak,"Dear Jack,

I hope this message finds you thriving. Your recent 'Welcome to the Wayborhood' initiative grabbed my attention with its innovative approach to personalized shopping experiences. It's inspiring to see Wayfair's dedication to creating unique connections with each customer.

At Streak, we share your enthusiasm for personalization. Our platform is designed to transform mass marketing by utilizing AI to tailor personalized email campaigns on a grand scale. Imagine the ability to dispatch millions of emails, each crafted to be as distinctive as the homes your customers love to furnish. This is the breakthrough that Streak offers.

Our AI-driven technology ensures that every communication is not just noticed but genuinely experienced, enhancing engagement and conversion rates in unprecedented ways. In today's era of overflowing inboxes, Streak guarantees that your messages not only reach your audience but also strike a chord with them.

Considering Wayfair's innovative collaboration with Pinterest on the 'Pinterest Creator Tour,' it's clear that pushing the boundaries of innovation and personalization is key to your marketing endeavors. Streak is poised to amplify these efforts by scaling your email marketing with an unparalleled level of personalization and creativity.

I'm eager to explore how Streak can seamlessly integrate with your marketing strategies to boost Wayfair's customer engagement and retention further. Together, we can ensure that every email is as meaningful as every product you offer, helping your customers craft the homes of their dreams.

Warm regards,
Omer Nauer
omern@streak.com
Marketing Specialist, Streak"
